{
  "schema_version": "1.0",
  "topic": "STK11 (LKB1) co-mutation and immunotherapy response in NSCLC",
  "generated_utc": "2026-09-03T00:00:00Z",
  "search": {
    "queries": [
      "STK11 LKB1 mutation anti-PD-1 PD-L1 outcomes NSCLC Skoulidis",
      "STK11 not predictive immunotherapy NSCLC \"no association\" failed to confirm",
      "STK11 KEAP1 KRAS co-mutation immunotherapy NSCLC KRAS-wildtype interaction 2023 2024",
      "KEAP1 mutation confounder STK11 immunotherapy NSCLC multivariable driver of poor outcome",
      "Papillon-Cavanagh STK11 KEAP1 prognostic biomarkers real-world lung adenocarcinoma ESMO Open 2020",
      "Ricciuti STK11 KEAP1 diminished efficacy PD-(L)1 inhibition lung adenocarcinoma KRAS mutation status JTO 2022",
      "KEYNOTE-042 KEYNOTE-189 STK11 KEAP1 mutation pembrolizumab chemotherapy exploratory analysis outcomes",
      "Kitajima STING suppression LKB1 loss KRAS lung cancer cGAS immune evasion Cancer Discovery 2019",
      "Koyama STK11 LKB1 deficiency neutrophil recruitment IL-6 T-cell suppression lung tumor microenvironment Cancer Research 2016",
      "ULK1 inhibition antigen presentation LKB1-mutant lung cancer Nature Cancer 2021 restores antitumor immunity",
      "POSEIDON durvalumab tremelimumab STK11 KEAP1 mutant NSCLC subgroup overall survival benefit",
      "STK11 LKB1 alterations chemo-immunotherapy pembrolizumab platinum inferior outcomes non-squamous NSCLC real-world",
      "STK11 mutation frequency ancestry African American East Asian lung adenocarcinoma smoking status never-smoker immunotherapy",
      "sex differences male female STK11 KRAS co-mutation immunotherapy outcome NSCLC",
      "STK11 mutation squamous cell lung carcinoma immunotherapy outcomes histology difference adenocarcinoma",
      "meta-analysis STK11 mutation immune checkpoint inhibitor NSCLC pooled hazard ratio overall survival 2023 2024",
      "\"STK11/LKB1-Deficient Phenotype Rather Than Mutation\" immunotherapy efficacy STING type I interferon CD8 JTO 2023",
      "bioRxiv medRxiv preprint STK11 LKB1 immunotherapy resistance NSCLC 2024 2025",
      "\"STK11\" lung cancer immunotherapy preprint site:biorxiv.org OR site:medrxiv.org",
      "STK11 KRAS G12C co-mutation sotorasib adagrasib immunotherapy outcome real-world cohort",
      "STK11 mutation immunotherapy NSCLC PD-L1 high TPS 50% subgroup outcome large cohort pembrolizumab monotherapy",
      "2025 large real-world cohort STK11 KEAP1 immunotherapy NSCLC re-examination predictive value confirmed"
    ],
    "sources": [
      "pubmed",
      "biorxiv",
      "medrxiv",
      "clinicaltrials.gov",
      "conference_abstract",
      "journal_site",
      "other"
    ],
    "date_range": {
      "from_year": 2016,
      "to_year": 2026
    },
    "notes": "Retrieval was mostly via Europe PMC REST (resultType=core, verbatim abstractText) and PubMed Central open-access full text. Several publisher sites (ScienceDirect, JTO, Annals of Oncology, ESMO Open, ascopubs, medRxiv PDF) returned HTTP 403 to automated fetches; where the record could not be opened the claim is marked verified=false and capped at moderate confidence. Europe PMC and bioRxiv began returning 503/429 near the end of the session, so one bioRxiv preprint (SMARCA4/STK11/KEAP1 co-inactivation, 2026) and the POSEIDON 5-year primary publication (PMID 39243945) could not be opened and are represented only by secondary reporting or omitted."
  },
  "entities": [
    {
      "entity_id": "E-001",
      "type": "gene",
      "name": "STK11",
      "synonyms": [
        "LKB1",
        "STK11/LKB1",
        "serine/threonine kinase 11",
        "KL (when co-mutated with KRAS)"
      ],
      "identifier": {
        "hgnc": "HGNC:11389",
        "ncbi_gene": "6794"
      }
    },
    {
      "entity_id": "E-002",
      "type": "gene",
      "name": "KRAS",
      "synonyms": [
        "K-ras",
        "KRAS G12C",
        "KRAS G12D"
      ],
      "identifier": {
        "hgnc": "HGNC:6407",
        "ncbi_gene": "3845"
      }
    },
    {
      "entity_id": "E-003",
      "type": "gene",
      "name": "KEAP1",
      "synonyms": [
        "Kelch-like ECH-associated protein 1"
      ],
      "identifier": {
        "hgnc": "HGNC:23177",
        "ncbi_gene": "9817"
      }
    },
    {
      "entity_id": "E-004",
      "type": "gene",
      "name": "TP53",
      "synonyms": [
        "p53",
        "KP (when co-mutated with KRAS)"
      ],
      "identifier": {
        "hgnc": "HGNC:11998",
        "ncbi_gene": "7157"
      }
    },
    {
      "entity_id": "E-005",
      "type": "gene",
      "name": "SMARCA4",
      "synonyms": [
        "BRG1"
      ],
      "identifier": {
        "hgnc": "HGNC:11100",
        "ncbi_gene": "6597"
      }
    },
    {
      "entity_id": "E-006",
      "type": "drug_class",
      "name": "anti-PD-1/PD-L1 checkpoint inhibition",
      "synonyms": [
        "ICI",
        "ICB",
        "PD-(L)1 blockade",
        "immune checkpoint inhibitor",
        "pembrolizumab",
        "nivolumab",
        "atezolizumab",
        "durvalumab",
        "sintilimab"
      ]
    },
    {
      "entity_id": "E-007",
      "type": "drug",
      "name": "pembrolizumab",
      "synonyms": [
        "MK-3475",
        "Keytruda"
      ]
    },
    {
      "entity_id": "E-008",
      "type": "drug",
      "name": "nivolumab",
      "synonyms": [
        "BMS-936558",
        "Opdivo"
      ]
    },
    {
      "entity_id": "E-009",
      "type": "drug",
      "name": "atezolizumab",
      "synonyms": [
        "MPDL3280A",
        "Tecentriq"
      ]
    },
    {
      "entity_id": "E-010",
      "type": "drug",
      "name": "durvalumab",
      "synonyms": [
        "MEDI4736",
        "Imfinzi"
      ]
    },
    {
      "entity_id": "E-011",
      "type": "drug",
      "name": "tremelimumab",
      "synonyms": [
        "anti-CTLA-4",
        "CTLA-4 blockade"
      ]
    },
    {
      "entity_id": "E-012",
      "type": "drug_class",
      "name": "platinum-doublet chemotherapy",
      "synonyms": [
        "carboplatin/pemetrexed",
        "platinum-based chemotherapy",
        "chemo-immunotherapy backbone"
      ]
    },
    {
      "entity_id": "E-013",
      "type": "biomarker",
      "name": "PD-L1 tumor expression",
      "synonyms": [
        "PD-L1 TPS",
        "CD274 expression"
      ]
    },
    {
      "entity_id": "E-014",
      "type": "biomarker",
      "name": "tumor mutational burden",
      "synonyms": [
        "TMB",
        "tTMB",
        "mutations/exome"
      ]
    },
    {
      "entity_id": "E-015",
      "type": "pathway",
      "name": "cGAS-STING / type I interferon signaling",
      "synonyms": [
        "STING",
        "TMEM173",
        "interferon-I signaling"
      ]
    },
    {
      "entity_id": "E-016",
      "type": "cell_state",
      "name": "CD8+ tumor-infiltrating lymphocyte",
      "synonyms": [
        "CD8+ TIL",
        "CD3+CD8+ T cell",
        "T-cell inflamed phenotype"
      ]
    },
    {
      "entity_id": "E-017",
      "type": "cell_state",
      "name": "tumor-associated neutrophil / MDSC",
      "synonyms": [
        "TAN",
        "myeloid-derived suppressor cell",
        "neutrophil infiltration"
      ]
    },
    {
      "entity_id": "E-018",
      "type": "pathway",
      "name": "antigen processing and presentation",
      "synonyms": [
        "immunoproteasome",
        "PSMB8",
        "PSMB9",
        "MHC class I presentation"
      ]
    },
    {
      "entity_id": "E-019",
      "type": "pathway",
      "name": "ULK1/ATG1 autophagy",
      "synonyms": [
        "autophagic flux",
        "ATG1"
      ]
    },
    {
      "entity_id": "E-020",
      "type": "clinical_feature",
      "name": "non-small cell lung cancer",
      "synonyms": [
        "NSCLC",
        "lung adenocarcinoma",
        "LUAD",
        "lung squamous cell carcinoma",
        "LUSC"
      ],
      "identifier": {
        "oncotree": "NSCLC"
      }
    },
    {
      "entity_id": "E-021",
      "type": "clinical_feature",
      "name": "smoking status",
      "synonyms": [
        "never-smoker",
        "former smoker",
        "current smoker",
        "tobacco exposure"
      ]
    },
    {
      "entity_id": "E-022",
      "type": "cell_state",
      "name": "STK11/LKB1-deficient transcriptomic phenotype",
      "synonyms": [
        "STK11-def",
        "LKB1 loss-of-function signature",
        "STK11 phenotype"
      ]
    }
  ],
  "claims": [
    {
      "claim_id": "C-001",
      "subject": {
        "type": "gene_combination",
        "name": "KRAS mutation + STK11/LKB1 mutation (KL)",
        "entity_ids": [
          "E-001",
          "E-002"
        ],
        "state": "co_mutation"
      },
      "predicate": {
        "effect": "decreases",
        "on": "objective response rate to PD-1/PD-L1 axis blockade",
        "magnitude": {
          "metric": "percent",
          "point_estimate": 7.4,
          "ci_low": null,
          "ci_high": null,
          "p_value": null
        },
        "direction_certainty": "reported_significant"
      },
      "context": {
        "disease": "non-small cell lung cancer, lung adenocarcinoma",
        "stage": "advanced/metastatic",
        "treatment": "PD-1/PD-L1 axis blockade (monotherapy, mostly nivolumab/pembrolizumab/atezolizumab)",
        "line_of_therapy": "any",
        "population": {
          "n": 174,
          "geography": "United States (MDACC, MSKCC, DFCI/MGH)",
          "ancestry_reported": false,
          "smoking_status": "not reported separately",
          "notable_exclusions": [
            "EGFR/ALK-altered tumors implicitly excluded by KRAS-mutant selection"
          ]
        },
        "model_system": "human_clinical"
      },
      "evidence": {
        "source_type": "pubmed",
        "citation": {
          "pmid": "29773717",
          "doi": "10.1158/2159-8290.CD-18-0099",
          "nct_id": null,